{
  "tool": "codex-cli",
  "model": "gpt-4",
  "timestamp": "2025-08-28T10:01:00Z",
  "pr": {
    "repo": "pyrepl3",
    "number": 1,
    "head_sha": "abc123",
    "branch": "feature-branch",
    "link": "https://github.com/user/pyrepl3/pull/1"
  },
  "summary": "Codex review complete. Found one security concern that should be addressed.",
  "assumptions": [
    {
      "text": "Input validation is properly implemented",
      "status": "uncertain",
      "evidence": [],
      "falsification_step": "Test with malformed input data"
    }
  ],
  "findings": [
    {
      "category": "security",
      "severity": "high",
      "file": "src/executor.py",
      "lines": "45-50",
      "message": "Potential command injection vulnerability in subprocess call",
      "suggestion": "Use shlex.quote() to properly escape shell arguments",
      "evidence": ["Direct string concatenation in subprocess call"],
      "must_fix": true
    }
  ],
  "tests": {
    "executed": true,
    "command": "pytest tests/",
    "exit_code": 0,
    "summary": "All tests passed",
    "coverage": 85.5
  },
  "metrics": {},
  "evidence": [],
  "exit_criteria": {
    "ready_for_pr": false,
    "reasons": ["Security vulnerability must be fixed"]
  }
}